{
  "schema_version": 1,
  "tools": {
    "python": {
      "executable": "__PYTHON__",
      "version_argv": ["__PYTHON__", "--version"],
      "expected_version": "__PYVERSION__",
      "required_modules": []
    }
  },
  "checks": [
    {
      "id": "check.custom",
      "category": "test",
      "group": "test",
      "argv": ["__PYTHON__", "__SCRIPT__"],
      "cwd": ".",
      "inputs": ["a.txt"],
      "dependencies": [],
      "timeout_seconds": 30,
      "selection": "project",
      "pass_filenames": false,
      "tool": "python",
      "version": "__PYVERSION__"
    }
  ],
  "candidate_preparations": [],
  "profiles": {
    "quick": ["check.custom"],
    "full": ["check.custom"],
    "security": ["check.custom"],
    "release": ["check.custom"]
  },
  "coverage_pending": {"quick": [], "full": [], "security": [], "release": []}
}
